{
  "contractVersion": 1,
  "id": "loveletter",
  "name": "The Correspondence",
  "appName": "Loveletter",
  "shortName": "Loveletter",
  "tagline": "Short love stories, kept the way letters are kept.",
  "author": "Loveletter Press",
  "themeColor": "#F8EFF0",
  "backgroundColor": "#F8EFF0",
  "defaultTheme": "light",
  "fonts": {
    "display": "Cormorant Garamond",
    "headers": "Cormorant Garamond",
    "body": "Lora",
    "mono": "Inter"
  }
}
