{
  "contractVersion": 1,
  "id": "storylark",
  "name": "Story Library",
  "appName": "StoryLark",
  "shortName": "StoryLark",
  "tagline": "Read it. Hear it. Take it anywhere.",
  "author": "StoryLark",
  "themeColor": "#FBF8F2",
  "backgroundColor": "#FBF8F2",
  "defaultTheme": "light",
  "fonts": {
    "display": "Newsreader",
    "headers": "Newsreader",
    "body": "Newsreader",
    "mono": "Inter"
  }
}
