{
  "contractVersion": 1,
  "id": "nebula",
  "name": "The Long Archive",
  "appName": "Nebula",
  "shortName": "Nebula",
  "tagline": "Every log the expedition sent back, kept in order.",
  "author": "Long Archive Press",
  "themeColor": "#171A21",
  "backgroundColor": "#171A21",
  "defaultTheme": "dark",
  "fonts": {
    "display": "Inter",
    "headers": "Inter",
    "body": "Newsreader",
    "mono": "IBM Plex Mono"
  }
}
